vignette_id,model,modality,response
1,GPT-4,CBT,"That’s a very honest and important insight — it sounds like your mind automatically zooms in on what could have gone better, rather than noticing what you actually accomplished. Over time, that pattern can make even successful achievements feel hollow and can increase anxiety, self-criticism, and exhaustion.
In CBT, we often work on balancing this internal focus on mistakes with an intentional practice of acknowledging accomplishments. A few strategies can help:
1.	Catch the thought: Notice when your mind starts focusing on “I could have done better.” Simply labeling it as a thought, rather than a fact, can reduce its power.
2.	Record successes: Keep a small journal or note of things you complete, no matter how small. Even acknowledging, “I finished that report” counts.
3.	Self-compassionate reflection: When reviewing work, ask yourself: “What did I do well here?” alongside “What could I improve?” — giving equal attention to achievements helps retrain your mind.
Would you like to try a quick exercise together now where we take one recent task and practice noticing both what went well and what could improve, in a balanced way?"
1,GPT-4,CBT," That sounds really heavy — carrying the weight of high parental expectations can leave you feeling like nothing you do is ever enough. When expectations are consistently high, it’s common to internalize that standard and then apply it to yourself, which can fuel the perfectionism, self-criticism, and anxiety you’ve been describing.
In CBT, we often work on examining those internalized standards and seeing whether they are realistic or helpful. Some steps we might take include:
1.	Identifying the expectation: What exactly is the message you’ve internalized from your parents? (“I must always succeed,” or “I must never make mistakes,” for example.)
2.	Testing the belief: Ask yourself, “If I don’t meet this expectation, what really happens?” Often, the consequences are not as catastrophic as your mind imagines.
3.	Self-compassion and reframing: Learning to respond to yourself as a supportive adult rather than a strict parent — reminding yourself that making mistakes or struggling does not make you less worthy.
Over time, this can reduce the constant sense of pressure and disappointment and help you start valuing your efforts rather than just the outcomes.
If you like, we can take one expectation you feel weighed down by and start working on reframing it together."
1,GPT-4,CBT,"That’s a really powerful and self-aware observation — and it captures something that many people experience without realizing it. It sounds like your sense of worth has become tied to doing rather than being. When you’re completing a task, your brain latches onto it as proof of purpose or value, but when you’re not producing something tangible, it tells you you’re “useless.” That’s an exhausting and painful loop to be in.
From a CBT perspective, this often comes from a core belief — something like “I have to achieve to have value” or “What I do defines who I am.” The tricky part is that these beliefs can drive short-term motivation but lead to long-term self-criticism and burnout.
A few things we might work on together are:
1.	Identifying the belief clearly — what’s the exact message you tell yourself about worth and achievement?
2.	Gathering evidence for and against it — are there examples of moments when you had value without achieving or producing something? (For instance, being kind, supporting a friend, or simply existing as yourself.)
3.	Building a more balanced self-concept — learning to see your worth as something intrinsic, not something you earn through performance.
Would you be open to trying a short exercise to identify that core belief more precisely, so we can begin loosening its hold on you?"
1,GPT-4,CBT,"I hear you — that feeling of jealousy can be really painful, especially when it comes with uncertainty about whether it’s “true” or not. Your mind is comparing your situation to others and focusing on what seems lacking, which is understandable given the pressures and self-criticism you’ve described.
In CBT, we often work on challenging these comparisons and noticing the difference between thoughts and facts. Just because your mind says, “They have better jobs and more fun,” doesn’t mean it’s objectively true — it’s a story your anxiety and self-criticism are telling. Often, these comparisons exaggerate differences and discount the positives in your own life.
A practical approach is:
1.	Notice the thought: Recognize when your mind is comparing. Label it as a thought rather than a fact.
2.	Look for evidence: Is there proof that your friends’ jobs are objectively better, or is it just your perception?
3.	Shift focus to your life: What aspects of your job or daily life are positive or meaningful? Even small things count.
If you like, we could pick one of these jealous thoughts and work through it step by step, seeing how much is fact, how much is interpretation, and how to respond in a balanced way."
1,GPT-4,CBT,"That sounds really heavy — it must feel exhausting to never let yourself feel satisfied with your achievements, no matter what you accomplish. What you’re describing is a common feature of perfectionism and self-criticism: the mind sets a moving target, so even real successes feel inadequate.
In CBT, one approach is to notice and label these “not enough” thoughts, rather than accepting them as truth. You can practice asking: “Is it really true that nothing I do is enough, or is this my anxious and critical mind speaking?”
Another strategy is building a balanced perspective on achievement:
•	Recognize the effort you put in, not just the outcome.
•	Acknowledge small wins — even minor progress is valid.
•	Compare to realistic standards, not the impossible ideal your mind sets.
Over time, this can help shift your experience from constant dissatisfaction to a more accurate and fair appraisal of your work and achievements.
If you like, we could take a recent work achievement and practice applying this kind of balanced reflection — seeing what actually counts as success rather than letting the “never enough” thought take over."
1,GPT-4,CBT,"I hear you — even when someone is loving and supportive, that flicker of worry can be distressing and exhausting. Often in situations like this, the concern isn’t about evidence of cheating, but about anxious thoughts and hypervigilance: your mind is scanning for threat where there likely isn’t any. That aligns with the hyper-alert patterns you’ve described in other areas of your life.
In CBT, we often work on these types of concerns by:
1.	Noticing the thought: Recognizing it as a thought rather than a fact — “Here’s a worry that my partner might be unfaithful, not proof that it’s true.”
2.	Looking for evidence: Objectively examining whether there’s any real sign of cheating, rather than relying on gut feelings or anxiety-driven assumptions.
3.	Response strategies: Instead of seeking constant reassurance or checking, we can develop ways to gently redirect your mind and tolerate uncertainty without letting it spiral.
It might help to practice a small exercise in recognizing these thoughts when they arise, labeling them, and deciding how much attention to give them — rather than automatically accepting them as reality.
Would you like to try that approach with one of the recent moments when this worry came up?"
1,GPT-4,CBT,"That’s an important and honest reflection — it shows that you’re paying attention to your own feelings, even if they’re uncertain or uncomfortable. It’s completely normal for doubts or questions to arise in a long-term relationship, especially if other areas of your life feel stressful or overwhelming. Anxiety can also amplify uncertainty, making it harder to distinguish between what’s your genuine feelings and what’s worry or fear.
In CBT, one approach is to explore your thoughts and feelings systematically:
1.	Identify the uncertainty: What specifically feels unclear — is it about the relationship itself, your future goals, or something else?
2.	Gather evidence: Look at your experiences in the relationship — moments of connection, support, and compatibility, as well as the challenges — without immediately judging them as “good” or “bad.”
3.	Distinguish feelings from assumptions: Notice when anxiety is coloring your interpretation versus what you actually feel about the relationship in calmer moments.
We can work together to gently clarify your thinking and feelings, so you can make decisions based on a realistic assessment rather than anxiety-driven “what ifs.”
Would you like to start by exploring what feels uncertain or conflicting about the relationship?"
1,GPT-4,CBT,"That’s a very insightful observation — noticing that pattern is an important first step. What you’re describing is actually quite common for people who feel anxious or hyper-alert: closeness can trigger a sense of vulnerability, which your mind interprets as a potential threat, even in a safe relationship. So pulling away can feel like a protective strategy, even though it’s uncomfortable for both you and your partner.
In CBT, we often approach this by:
1.	Noticing the triggers: Recognizing the moments when you start to pull away and what thoughts or feelings arise.
2.	Labeling the response: Seeing it as a natural protective reaction rather than a flaw in yourself or the relationship.
3.	Gradual exposure: Practicing small steps of closeness while using grounding or calming techniques, so your mind learns that intimacy doesn’t have to be threatening.
We can also explore the underlying thoughts — for example, worries about being overwhelmed, judged, or hurt — and gently challenge them. Over time, this can help you feel more comfortable with intimacy without feeling the need to retreat.
If you like, we could pick a recent moment of closeness and break down what was happening, so we can start to work with this pattern."
1,GPT-4,CBT,"Yes — there can be a meaningful difference, and it’s actually quite common to notice that distinction in long-term relationships.
•	Love is often about care, attachment, and commitment. You value the person, want to support them, and feel a bond. That can remain even when the intensity of passion or excitement changes.
•	Being “in love” usually refers to the more intense romantic feelings, desire, and excitement that often appear in the early stages of a relationship. Over time, those feelings can shift or fluctuate without meaning the love itself has disappeared.
What you’re noticing — uncertainty about being “in love” — doesn’t automatically mean the relationship is failing. It can be a sign that your feelings have matured, or that you’re reflecting on what you really want in your life right now.
In CBT, we might explore this by separating:
1.	Feelings versus assumptions: Noticing what you actually feel in the moment versus the anxious “what ifs” or comparisons with an idealized version of romance.
2.	Evidence of attachment and care: Looking at the ways you still connect, support, and enjoy being with your partner.
3.	Values and goals: Considering whether the relationship aligns with what matters most to you, rather than trying to force a particular intensity of feeling.
We could do a short exercise where we map out what you love about them versus what you’re uncertain about. That often brings clarity without letting anxiety dominate the thinking.
Would you like to try that now?"
1,GPT-4,CBT,"I hear you — those “arguments over nothing” can feel especially frustrating, because they often leave you emotionally drained without a clear reason. From what you’ve described about your anxiety and high-alert thinking, it makes sense that even small disagreements can feel bigger than they actually are. When we’re anxious or hypervigilant, our brains can interpret minor tensions as significant threats to connection or safety.
In CBT, we often approach this by:
1.	Looking at the triggers: What thoughts or interpretations came up for each of you during the argument? Often, it’s not the external event but the meaning we assign to it that escalates tension.
2.	Identifying patterns: Noticing recurring arguments or triggers can help prevent the same cycle from repeating.
3.	Grounding and perspective-taking: Techniques to calm your nervous system during conflict can help you respond rather than react, making resolution easier.
If you like, we could break down last night’s argument together — what happened, what each of you thought or felt, and how you might respond differently next time to reduce tension. That often makes these conflicts feel much less overwhelming."
1,GPT-4,CBT,"That’s a very understandable fear — it ties closely to the anxiety and self-criticism you’ve described in other areas of your life. When we worry that our “true self” isn’t acceptable, it often comes from internalized messages about needing to be perfect or always meet others’ expectations.
In CBT, we often explore these fears by separating thoughts from reality:
1.	Notice the anxious thought: “If I’m truly myself, they won’t want to be with me.”
2.	Examine the evidence: Are there concrete signs that being yourself has caused rejection, or is it a fear based on assumptions?
3.	Consider alternative interpretations: Could your partner value and accept you for who you are, even with imperfections?
4.	Practice gradual authenticity: Start sharing small parts of your true self in safe ways, and observe the response. Over time, this can build confidence that you can be authentic without losing the relationship.
We can also look at why you feel the need to hide parts of yourself — often it’s connected to past experiences or high self-expectations — and gently work on building self-acceptance alongside the relationship.
Would you like to explore a small, concrete example of a moment when you held back from being yourself, so we can start practicing this approach?"
1,GPT-4,CBT,"That’s a very honest and important reflection — it’s normal to notice those thoughts, especially when you’ve been feeling anxious, exhausted, and uncertain about yourself and your relationships. Sometimes fear of being alone can influence decisions, even in long-term relationships, but noticing it is the first step in understanding what’s truly motivating you.
In CBT, we often explore these thoughts by:
1.	Separating fear from genuine desire: What parts of your relationship feel fulfilling or meaningful to you, and what parts feel like you’re staying out of fear?
2.	Examining the evidence: Are there times you’ve enjoyed independence, or moments where being alone felt okay or even good?
3.	Exploring values and priorities: Considering what you want in a relationship, and whether staying aligns with your deeper values rather than just avoiding loneliness.
It can be helpful to reflect on both sides — what draws you to your partner, and what might be fear-based. That way, you can make choices that feel authentic rather than reactive.
If you like, we could start by identifying specific moments that feel like genuine connection versus moments that feel motivated by fear. That often brings clarity without judgment."
1,GPT-4,CBT,"It sounds like you’re in a really challenging spot — wanting closeness, but at the same time feeling anxious and pulling back. The fact that you’re noticing yourself finding reasons to delay shows a lot of self-awareness. What you’re describing is actually a very common pattern called avoidance or self-sabotage, where anxiety makes us protect ourselves by keeping distance, even from people we care about.
In CBT, we often approach this by:
1.	Identifying the fear: What thoughts or images come up when you think about moving in together? Is it about losing independence, being judged, or something else?
2.	Separating thoughts from facts: Noticing when the mind is predicting worst-case scenarios that haven’t happened.
3.	Gradual exposure: Breaking the situation into smaller, manageable steps rather than trying to tackle it all at once — for example, short stays, trial periods, or discussing boundaries before fully moving in.
The goal isn’t to force you into something you’re not ready for, but to help you understand the pattern and make choices consciously rather than letting anxiety drive the decisions.
We could start by mapping out what specific fears come up for you around moving in — that often makes the next steps clearer and less overwhelming."
1,GPT-4,CBT,"I hear you — comparing yourself to others, especially on social media, can really amplify feelings of anxiety, inadequacy, or loneliness. What you’re noticing is very common: social media often shows a polished, highlight-reel version of people’s lives, not the full reality with challenges or struggles.
In CBT, we look at these kinds of comparisons as cognitive distortions — specifically “mental filtering” and “discounting the positives” in your own life. Your mind is focusing on what seems lacking, while ignoring evidence of what’s going well.
A few strategies can help:
1.	Reality check: Remind yourself that social media posts are curated snapshots, not the full picture of anyone’s relationship or happiness.
2.	Shift attention: Focus on your own meaningful experiences or achievements, however small.
3.	Limit exposure or reframe: If scrolling triggers anxiety or negative thoughts, consider taking breaks or consciously reframing your view: “This is a highlight, not the whole story.”
We could also explore what aspects of their relationships you admire or wish for, and whether there are small, realistic steps you could take to bring more of those experiences into your own life, without relying on comparison.
Would you like to try that exercise together?"
1,GPT-4,CBT,"That’s a very honest and important reflection — it shows that you’re paying attention to your feelings rather than just going through the motions. It’s natural to question a relationship, especially when you’re experiencing anxiety, uncertainty, and self-doubt, because those feelings can amplify doubts and make it hard to separate genuine concerns from anxious “what if” thinking.
In CBT, we often approach this by:
1.	Clarifying values and needs: What do you truly want from a partner and a relationship? Which aspects are essential for your happiness?
2.	Distinguishing anxiety from reality: Noticing when thoughts like “maybe it’s not right” are based on worry, fear, or past patterns, versus actual evidence about compatibility.
3.	Gathering evidence: Reflecting on your experiences in the relationship — what feels positive, supportive, and fulfilling, and what consistently feels troubling or incompatible.
A helpful exercise is to make a list of your relationship needs versus your anxieties. That often brings clarity about whether your doubts are coming from fear or from real incompatibility.
We could do that together now if you like — it usually helps make next steps feel less overwhelming."
1,GPT-4,CBT,"That’s a very common experience, even if it feels isolating — many people don’t have everything figured out at 28, and the pressure to “have it all together” can amplify anxiety and self-criticism. What you’re noticing is partly a comparison trap: your mind is looking at others’ lives (or what you think you see) and using it as a benchmark for your own worth.
In CBT, we often approach this by:
1.	Separating facts from assumptions: Just because someone appears to have figured things out doesn’t mean they actually have, or that you’re behind.
2.	Exploring values and interests: Instead of looking for a single “life path,” we identify what matters most to you — work, relationships, creativity, contribution — and see what steps align with those values.
3.	Breaking it into manageable steps: Rather than solving your entire life at once, focus on small experiments or decisions that move you toward a direction you care about.
We could start by exploring one area that matters to you — for example, work, creativity, or personal growth — and see what small, achievable steps might help you feel more purposeful without needing to have your whole life mapped out.
If you like, we can do that now."
1,GPT-4,CBT,"That sounds like a really painful realization — almost like you’re standing outside your own life, watching it happen to someone else. When people have been under prolonged stress, anxiety, or pressure to meet expectations, it’s quite common to reach a point where they feel disconnected from who they used to be. It’s as if somewhere along the way, you’ve been so focused on surviving, coping, or meeting demands that you’ve lost touch with your sense of self.
In CBT, we’d approach this with compassion and curiosity rather than judgment. A few gentle steps can help:
1.	Name the loss – Acknowledge that feeling disconnected from yourself is a kind of grief. Something important feels missing, and that matters.
2.	Trace the shift – Look back at the times when you did feel more like yourself. What was different about how you spent your time, what you valued, or how you treated yourself?
3.	Rebuild identity through values – Instead of trying to “get back” to an old version of you, explore what feels meaningful now — what qualities, activities, or relationships align with who you want to become next.
Sometimes I’ll ask clients: “When do you still catch glimpses of the ‘you’ that feels most authentic — even if it’s fleeting?” Those moments, however small, are often the starting point for reconnecting with yourself.
Would you be open to exploring when you last remember feeling more like yourself?"
1,GPT-4,CBT,"Thank you for sharing that — it sounds really draining, like even the things meant to bring you joy get weighed down by guilt or self-criticism. That feeling of “just existing” is often a sign that anxiety, perfectionism, and self-worth struggles are taking up most of your mental energy, leaving little space for genuine enjoyment.
In CBT, we often work on this in a few ways:
1.	Noticing the guilt – When you feel guilty while doing something enjoyable, pause and identify the thought: “I shouldn’t be doing this” or “I’m wasting time.” Labeling it as a thought can reduce its automatic pull.
2.	Scheduling enjoyment intentionally – Plan small activities you want to do, and give yourself permission to engage fully, while noting that guilt is just a passing thought, not a rule you have to obey.
3.	Experimenting and reflecting – Keep track of what actually brings a spark of interest or relaxation, even briefly. Over time, these small moments help rebuild a sense of passion and agency.
We could start with a very small exercise: pick one activity you enjoy or want to try, and plan it for a specific time. Then, notice the thoughts and feelings as they arise, label the guilt as just a thought, and see how it feels to do the activity anyway."
1,GPT-4,CBT,"I hear you — that’s a very common experience, especially when we make choices based on logic, practicality, or external expectations rather than what truly brings us fulfillment. It can feel heavy when you realize the path that “made sense” hasn’t actually aligned with your happiness or values.
In CBT, we often approach this by:
1.	Identifying values – What does matter to you in a career or daily life? Creativity, autonomy, helping others, stability? Naming these can clarify what’s missing.
2.	Separating practical choices from fulfillment – It’s possible to honor practical considerations while exploring ways to make your work more meaningful or to find satisfaction elsewhere.
3.	Small experiments – Trying out activities, side projects, or new routines that align with your values can help you reconnect with what feels energizing and meaningful, without needing to make a huge career leap immediately.
We could start by exploring one aspect of your work or life where you could experiment with adding meaning or enjoyment — something small but noticeable — and see how it feels.
Would you like to try that together?"
1,GPT-4,CBT,"That makes a lot of sense — it sounds incredibly draining. What you’re describing is a common pattern when anxiety, perfectionism, and high alertness dominate your mental energy. During work, your mind is running on “auto-pilot” just to get through tasks, and afterward, there’s nothing left — both physically and mentally — which makes even small activities feel overwhelming.
In CBT, we often approach this by:
1.	Noticing the pattern – Recognizing the auto-pilot mode and the post-work exhaustion helps you understand it’s not laziness or failure, but a response to chronic stress.
2.	Energy management – Introducing small, structured breaks during work, grounding techniques, or mini self-care routines can reduce cumulative fatigue and anxiety.
3.	Recovery rituals – Building simple, low-effort ways to decompress after work, even for a few minutes, can help shift from “exhausted autopilot” to a more mindful and restorative state.
We could start by mapping out a small routine for after work — even 10–15 minutes — that allows your body and mind to recover without feeling like another task. This often makes the evenings feel less impossible and gradually restores energy for other parts of life.
Would you like to plan one small post-work recovery step together?"
