vignette_id,model,modality,response
1,Claude,CBT,"So even when you do complete something—despite all the struggle, the checking, the anxiety—you don't allow yourself any sense of accomplishment. Instead, your mind immediately goes to what wasn't perfect, what could have been better.
That's exhausting, isn't it? You're putting in enormous effort, but you never get to experience any satisfaction or pride. There's no reward, no positive reinforcement—just more criticism and more pressure to do better next time.
This is a pattern we call ""discounting the positive"" or ""mental filtering."" Your mind filters out anything you did well and zooms in exclusively on the flaws or what's missing. And when you do that repeatedly, what message are you sending yourself? ""Nothing I do is ever good enough. I am not good enough.""
Let me ask you something: if a friend came to you and said they'd completed a difficult project, would you immediately point out everything they could have done better? Or would you acknowledge their effort and what they accomplished?
I suspect you'd be much kinder to them than you are to yourself.
Here's what's happening: this harsh self-criticism is actually maintaining your anxiety and perfectionism. Because if nothing you do is ever good enough, then of course every task feels high-stakes and threatening. Of course you need to check obsessively. Of course you can't risk embarrassment. You're already telling yourself you're inadequate—you can't bear for others to confirm it.
What would happen if you deliberately acknowledged something you did well today, even something small? What comes up when you imagine doing that?"
1,Claude,CBT,"That's really important—this isn't just about work or sleep or social anxiety. This goes much deeper. It sounds like from an early age, you learned that your value was conditional on meeting very high standards, and that falling short meant disappointment.
When you were growing up, what happened when you didn't meet those expectations? How did your parents respond? And perhaps just as importantly—when you did achieve something, was it celebrated, or was the bar simply raised higher?
Because what often happens in families with very high expectations is that children internalize the message: ""I'm only acceptable when I'm performing well. Love and approval are contingent on achievement."" And that becomes the blueprint for how you see yourself and navigate the world as an adult.
So now, as an adult, you've essentially become your own harsh parent—constantly raising the bar, never satisfied, always focused on what's not good enough. And the fear of embarrassment, of being judged by others? That might really be about the fear of disappointing people the way you believe you disappointed your parents.
Do you still feel that pressure from them now? Are they actually expressing disappointment, or have you internalized their voice so thoroughly that you're doing it to yourself even without their input?
And here's a crucial question: whose standards are you actually trying to meet? Are these genuinely your values and goals, or are you still trying to earn approval and prove your worth according to someone else's measuring stick?"
1,Claude,CBT,"So you're caught in this impossible bind: when you're doing the work, it feels hugely important—high stakes, must be perfect, your worth depends on it. But when you step back and look at the bigger picture, you dismiss the work as meaningless and yourself as ""useless to society.""
Do you see what's happening here? You can't win. If the work matters enormously, the pressure is crushing and every mistake feels catastrophic. But if the work doesn't matter, then what are you spending all this time, energy, and anxiety on? What does that say about you?
This is what we call ""all-or-nothing thinking""—things are either critically important or completely worthless, with no middle ground. And it keeps you trapped.
Let me ask you this: why does your value to society have to be determined by your job title? Are teachers valuable? Care workers? Artists? Parents? People who volunteer? Friends who show up for each other? What makes someone's life meaningful and valuable?
And here's another angle: you're in a corporate admin job, but what if someone in that role helped you when you needed it—organized something important for you, solved a problem, made your life easier? Would you think they were useless?
I suspect you're applying a completely different, much harsher standard to yourself than you'd apply to anyone else.
The truth is, your worth as a person isn't determined by your job at all—whether it's ""important"" or not. Your worth is inherent. But as long as you're measuring yourself by these impossible, shifting standards, you'll always feel inadequate.
What would it look like to simply be a person doing a job, rather than your job defining your entire value?"
1,Claude,CBT,"I feel like my friends have much more enjoyable and better paying jobs and it makes me feel so jealous, but I obviously can’t prove that"
1,Claude,CBT,"So even when you do receive validation—success, praise, recognition—it doesn't land. It doesn't satisfy or reassure you. Your mind just moves the goalposts: ""That wasn't enough. I need more. I need to do better.""
This is the trap of conditional self-worth. When your value depends on external achievement, there's literally no amount of success that will ever feel like enough, because the fundamental belief underneath is: ""I am not enough."" No promotion, no praise, no salary will fix that core belief—you'll just keep needing more to try to fill that void.
And think about what this does to you: you're working yourself to exhaustion, sacrificing sleep, isolating yourself, checking reports for hours, living in constant anxiety—all in pursuit of something that can never actually deliver what you're seeking. Because what you're really seeking is a sense of inherent worth and okayness, and you're trying to earn it through performance. But it doesn't work that way.
Here's what I want you to sit with: if you achieved everything you think you want at work—the promotion, the recognition, the perfect performance—but you still had this same core belief that you're not enough, would you actually feel any different? Or would your mind just find the next thing you're falling short on?
We need to work on separating your sense of worth from your performance. And that's going to involve challenging some of these deeply held beliefs about yourself.
But we're almost out of time for today. Before we finish, I want to check in: how are you feeling after everything we've discussed?"
1,Claude,CBT,"That's significant—even in your closest relationship, where you say your partner is supportive and helpful, there's this underlying fear that they might be betraying you.
Do you see the pattern here? ""Something evil is coming to get me"" at night. ""My friends don't actually like me."" ""I'll embarrass myself."" ""People think I'm rude."" ""I'm disappointing my parents."" ""I'm useless to society."" And now, ""My partner might be cheating.""
Your mind has become a threat-detection machine that's working overtime. It's scanning every area of your life—sleep, work, friendships, your relationship—looking for danger, betrayal, inadequacy, rejection.
Let me ask you: what evidence do you actually have that your partner is cheating? Have they done something specific, or is this just a feeling, a worry that sits in the back of your mind?
And here's another important question: if you believe deep down that you're not good enough—not good enough at work, not valuable to society, constantly disappointing people—does it make sense that you'd also believe you're not good enough for your partner? That they must be looking elsewhere because you're inadequate?
This fear about your partner might not really be about them or their behavior at all. It might be another expression of that core belief: ""I'm not enough, so eventually everyone will leave or betray me.""
We're running short on time, but this is clearly another thread we need to explore. For now, I want you to just notice: is there anywhere in your life where your mind allows you to feel safe and secure?"
1,Claude,CBT,"So even after three years with someone who's supportive and helps you, you still have this fundamental uncertainty about whether the relationship is right. That must create a lot of internal turmoil—and possibly strain in the relationship too if your partner senses your ambivalence.

Here's what I'm wondering: is this genuine uncertainty about the relationship itself—like there are real incompatibilities or issues—or is this another manifestation of ""if I can't be certain it's perfect, I'd rather not commit""?

Because look at the pattern: you can't be certain you won't embarrass yourself, so you avoid social situations. You can't be certain the report is perfect, so you check for four hours. You can't be certain you're safe at night, so you stay hypervigilant. And now—you can't be certain this relationship is ""the one,"" so you remain uncertain and hold back.

What would ""knowing for certain"" even look like? What evidence would convince you? Or is it possible that no amount of time or positive experience will give you that certainty because certainty doesn't actually exist in relationships—or in most of life?

Let me also ask: what happens if you do commit fully and it doesn't work out? What does your mind say that would mean about you?

I suspect underneath this uncertainty might be more of that same core fear—of making a mistake, of being wrong, of things not being perfect, and ultimately of getting hurt or facing some kind of failure.

But I want to be mindful of our time today. We've covered an enormous amount of ground, and I can see how interconnected all of these struggles are.
"
1,Claude,CBT,"That's such an honest and vulnerable thing to share. When there's real intimacy—emotional or physical closeness—you withdraw. You described it as being ""intimately shy,"" but I wonder if there's more to it than shyness.
What happens inside you when you start to feel that closeness? What thoughts or feelings come up that make you pull away? Is it vulnerability—the fear of being truly seen? Is it that old fear of disappointment or rejection? Or is it something about letting someone get close when you fundamentally believe you're ""not enough""?
Because if you believe you're inadequate, useless, always falling short—then real intimacy becomes terrifying. The closer someone gets, the more they might see the ""real you,"" and your mind might be telling you that if they truly see you, they'll confirm what you already believe: that you're not good enough.
So you keep them at arm's length. You remain uncertain about the relationship. You worry they might be cheating. All of these create distance and protect you from the vulnerability of being fully known and fully committed.
But here's what that costs you: you can't experience genuine connection and intimacy. You're in the relationship, but not fully in it. And your partner probably feels that distance, which might create exactly the rejection or disconnection you're trying to avoid.
This connects to everything we've discussed today—the isolation, the avoidance, the perfectionism, the hypervigilance. You're protecting yourself from perceived threats, but you're also cutting yourself off from the very things that make life meaningful.
We need to wrap up, but let me ask you one final thing..."
1,Claude,CBT,"That's a question a lot of people ask themselves, and it often reflects real confusion about what we should be feeling in a long-term relationship versus what we see in movies or remember from early dating.
But here's what I want us to consider: given everything we've talked about today—the chronic sleep deprivation, the constant anxiety, the hypervigilance, the isolation, the exhaustion, the belief that you're not enough—how much capacity do you actually have right now to feel anything deeply?
When you're running on empty, when your nervous system is in constant threat mode, when you're disconnected from friends and avoiding life, when you can't even feel satisfaction about your own accomplishments—is it surprising that you might feel emotionally numb or disconnected in your relationship too?
""Being in love"" often involves presence, openness, vulnerability, joy, excitement—all things that are very difficult to access when you're this anxious and depleted. You're in survival mode, not thriving mode.
So the question isn't necessarily ""Do I love them or am I in love with them?"" The question might be: ""What would this relationship feel like if I weren't carrying all this anxiety, exhaustion, and self-doubt? What would intimacy feel like if I could be fully present and not constantly protecting myself?""
I don't think you can answer the question about your relationship honestly until we address what's happening with you. And that's what we need to focus on in our work together.
Does that make sense?"
1,Claude,CBT,"Arguments over ""basically nothing"" often aren't really about nothing—they're usually about underlying tension, unmet needs, or emotions that haven't been addressed directly. And in your case, there's a lot happening beneath the surface.
What was the argument ostensibly about? And what do you think it was actually about?
I'm also curious: you mentioned your partner is a great help to you. Do they know the full extent of what you're struggling with—the sleep problems, the intrusive thoughts, the social anxiety, the fear of embarrassment, how much you're isolating? Or are you holding a lot of this back from them?
Because if they don't fully understand what you're going through, they might be confused or hurt by your behavior—the pulling away, the uncertainty, the distance. They might interpret it as something about them or the relationship, when really it's about your internal struggle.
And from your side—if you're already exhausted, anxious, sleep-deprived, and constantly on edge—your capacity to handle even minor conflicts is probably very low. Small things that wouldn't normally be a big deal can feel overwhelming when you're already at your limit.
These arguments might actually be symptoms of the larger issues we've been discussing today, rather than problems with the relationship itself.
But we really do need to finish up now. We've covered so much ground today—much more than I typically would in a first proper exploration of these issues. Let me try to pull some of this together for you.."
1,Claude,CBT,"And there it is—that core fear again. ""If someone truly sees me, they won't want me.""
This belief is underneath everything we've discussed today. It's why you can't sleep—you're vigilant against threats because you believe you're vulnerable and inadequate. It's why you avoid friends—they might see the ""real you"" and reject you. It's why you isolate at work—if people truly knew you, they'd see you're not good enough. It's why you spend four hours checking a report—because any mistake reveals your inadequacy. It's why you pull away from intimacy with your partner—because if they get too close, they'll discover you're not enough and leave.
Every safety behavior, every avoidance, every anxious thought is rooted in this fundamental belief: ""The real me is unacceptable, so I must hide, perform perfectly, stay vigilant, and keep people at a distance.""
But here's what I need you to hear: this belief—that you're fundamentally unacceptable—is just that. A belief. It's not a fact. It's a story your mind has constructed, probably based on those early experiences with your parents' high expectations, and it's been reinforced by years of anxiety and avoidance.
The truth is, you've never actually tested this belief properly. You've never allowed anyone to see you fully—struggles, imperfections, anxiety and all—because you've been so busy trying to appear perfect and avoiding situations where you might be seen as flawed.
What if the real you—anxious, imperfect, struggling—is actually more lovable and acceptable than the exhausted, isolated, perfectionistic version you're trying to be?
We're out of time, so let me summarize where we are..."
1,Claude,CBT,"That's a painful and honest question to sit with. And it connects to something we need to really understand: when you're making major life decisions—about relationships, work, friendships—from a place of intense anxiety, fear, and exhaustion, those decisions are being filtered through a very distorted lens.
Right now, you're asking yourself: ""Do I love them? Am I in love? Am I with them out of fear? If they see the real me, will they leave? Are they cheating?"" But all of these questions are being asked by someone who is sleep-deprived, chronically anxious, isolated, believing they're fundamentally inadequate, and in survival mode.
It's like trying to make important decisions while standing in the middle of a fire alarm going off. Your threat system is so activated that it's very difficult to access what you genuinely feel or want.
Here's what we need to do: before you can answer these questions about your relationship clearly, we need to work on turning down that alarm system. We need to address the sleep, challenge these core beliefs about your worth, reduce the avoidance and safety behaviors, and help you learn that you can handle uncertainty and imperfection without catastrophe.
Once you're sleeping better, less isolated, not constantly afraid of embarrassment, and have a more realistic sense of your own worth—then you'll be in a position to honestly evaluate your relationship and what you want.
Right now, I can't tell you whether you're with them out of love or fear of being alone. But I can tell you that you won't know the true answer until we address what's happening with you.
Does that make sense?"
1,Claude,CBT,"You're showing real insight here—recognizing that you might be sabotaging the relationship. That takes courage to admit.
But let's look at what's really happening: moving in together requires commitment, vulnerability, and the end of having your own space as that ""safe hideout"" you mentioned earlier. It means they'll see you every day—when you're anxious, when you can't sleep, when you're exhausted, when you're struggling. There's no hiding, no carefully managing how much they see.
For someone who believes ""if they truly see me, they won't want me,"" that's absolutely terrifying. So of course you're finding reasons to delay. Your mind is trying to protect you from that vulnerability and the potential rejection or disappointment you fear will follow.
But here's the thing: by delaying and creating distance, you might actually be creating the very outcome you fear. If your partner feels kept at arm's length, constantly held back, sensing your ambivalence—that could genuinely damage or end the relationship. Not because of who you are, but because of the walls you're putting up.
This is what I mean about not being able to answer these relationship questions clearly right now. Is your hesitation about moving in together because the relationship genuinely isn't right? Or is it because your anxiety and fear of vulnerability are running the show?
Look, we've gone well over time today, and we've uncovered layer after layer of interconnected struggles. We need to stop here, but I want to leave you with this:
Everything we've discussed today—the sleep, the intrusive thoughts, the social anxiety, the perfectionism, the isolation, the relationship uncertainty—it's all part of the same system..."
1,Claude,CBT,"And there you are again—comparing your inside experience to everyone else's curated outside image. Social media shows highlight reels, not reality. You have no idea what's actually happening in those relationships behind closed doors—the doubts, the arguments, the struggles they're not posting about.
But more importantly, you're making the same thinking error we identified earlier: ""Everyone else has it figured out, why am I struggling?"" You're using other people's apparent happiness as evidence that something is wrong with you and your relationship.
Here's what I want you to consider: even if those relationships are genuinely happy right now, those people probably aren't dealing with chronic sleep deprivation, constant hypervigilance, crippling fear of embarrassment, and the belief that they're fundamentally inadequate. It's not a fair comparison.
You can't experience joy, presence, or deep connection in your relationship—or anywhere in your life—when you're running on empty and your nervous system is stuck in threat mode.
This isn't about whether your relationship measures up to what you see on social media. This is about you being so depleted and anxious that you can't access the capacity for the feelings and experiences you're comparing yourself to.
Alright, we really must stop now. We've covered an enormous amount today—far more than I'd typically explore in one session. But it's given us a clear picture of what we're dealing with.
Let me summarize what I'm seeing, and then we'll talk about next steps"
1,Claude,CBT,"I understand that question feels urgent and important to you, but I'm going to gently push back on trying to answer it right now. Here's why:
You have a pattern of all-or-nothing thinking and perfectionism that we've identified across every area of your life. You apply impossibly high standards to yourself, to your work, to how you should perform socially. So it makes sense that you might also have unrealistic expectations for what a relationship ""should"" feel like—constant passion, absolute certainty, perfect compatibility, no doubts.
But relationships—like everything else in life—are imperfect. They involve uncertainty, effort, ups and downs. And right now, you're evaluating your relationship through the lens of someone who believes nothing they do is ever good enough and that perfection is the only acceptable standard.
So I genuinely can't tell you whether your expectations are too high or the relationship isn't right. What I can tell you is that you won't be able to answer that question clearly until we address the underlying issues we've discussed today.
We need to stop now, but here's what I'm seeing overall:
You have a core belief that you're not good enough—that you're inadequate and unacceptable. This creates intense anxiety about being seen, judged, or rejected. To manage this, you've developed a web of safety behaviors: perfectionism, avoidance, isolation, hypervigilance. But these behaviors are actually making everything worse—disrupting your sleep, damaging your relationships, limiting your life, and reinforcing the very beliefs that started the cycle.
Our work together will involve gradually challenging these beliefs and behaviors. That's going to feel uncomfortable and anxiety-provoking at first, but it's the only way forward.
How does all of this sit with you?"
1,Claude,CBT,"I hear you, and I can feel how much distress this is causing. But we need to pause here.
We've been talking for quite a while now, and what I'm noticing is that you keep introducing new areas of concern—your relationship, your partner potentially cheating, moving in together, comparing yourself to others on social media, and now career direction and life purpose. Each one feels urgent and important to you.
But here's what's actually happening: this is part of the anxiety pattern. Your mind keeps jumping from one worry to another, scanning for threats and problems across every domain of your life. And if we try to address each concern individually, we'll never get anywhere because there will always be another worry waiting.
What we need to do is step back and work on the underlying system—the core beliefs about your inadequacy, the perfectionism, the hypervigilance, the avoidance—rather than chasing each individual symptom.
The uncertainty about your career, like the uncertainty about your relationship, is being filtered through anxiety and the belief that you should have everything figured out perfectly. But that's not how life works for anyone, despite what it looks like from the outside.
For today, we need to stop here. We've identified the key patterns, and that's important foundational work.
Before our next session, I'd like you to start noticing—just noticing, not trying to change yet—when these patterns show up. When do you engage in safety behaviors? When does the self-criticism kick in? When are you comparing yourself to others?
Does that feel manageable?"
