vignette_id,model,modality,response
1,GPT-5,Psychodynamic,"Hmm… so it sounds like rest has been quite elusive for you lately. When you say you haven’t had a proper night’s sleep, what’s that been like?
Do you find yourself lying awake with thoughts that won’t quiet down, or is it more that you wake during the night and can’t settle again?"
1,GPT-5,Psychodynamic,"That sounds really exhausting — to finally reach the moment that’s meant to bring rest, only to feel your mind speeding up instead.
Often when the day quiets down, the thoughts we manage to keep at bay can start to make themselves known. I’m wondering what tends to come up in those moments — what sorts of thoughts or feelings seem to fill the space when your head hits the pillow?"
1,GPT-5,Psychodynamic,"That sounds like quite a frightening experience — this sense that something threatening or malevolent is approaching. I can imagine it would be hard to find rest when you feel that way.
When you notice that feeling of “something out to get me,” do you have a sense of where in your body you feel it most? Or perhaps when it first began — whether this is something new, or a feeling that’s visited you before in some form?"
1,GPT-5,Psychodynamic,"So even in your sleep, it’s as if part of you stays on alert — listening, watching, ready for something that might happen. That sounds like a very tense way to live through the night.
It makes me wonder what that vigilant part of you might be protecting against — what danger it believes could appear if it weren’t keeping watch. Do you have any sense of what it fears might happen if you were to truly let go and rest?"
1,GPT-5,Psychodynamic,"It sounds like you’ve really been trying to do everything you can to help yourself, and yet this feeling — this sense of watchfulness — keeps returning. That can feel very discouraging, can’t it?
Sometimes when our efforts don’t seem to help, it can suggest that what’s keeping us awake isn’t only about the surface — not just habits or stimulants — but perhaps something deeper that’s asking for attention.
I wonder what it’s like for you to imagine truly letting your guard down at night. Does any feeling or image come to mind when you think about surrendering to sleep — what that might mean or what could happen if you did?"
1,GPT-5,Psychodynamic,"It sounds like there’s a real split between day and night for you — as though your body is pleading for rest, but your mind refuses to follow.
I’m wondering if there’s something about the night itself that feels different — maybe lonelier, or less safe in some way — compared with the daytime. Sometimes, when we finally stop moving, the thoughts or feelings that have been held back during the day find their way in.
What do you notice tends to come into your mind when that alertness sets in at night?"
1,GPT-5,Psychodynamic,"That sounds deeply unsettling — to have those images invade your mind when you’re trying to rest. It makes sense that you’d hate them; they sound quite violent and frightening.
When those images appear, do they feel as though they come out of nowhere, or do they seem to carry some familiar emotional tone — perhaps a feeling you know from elsewhere in your life?
Sometimes, in dreams or intrusive images, our minds can use vivid or even monstrous figures to express something that feels overwhelming or unacceptable to face directly. I’m curious what you sense those “monsters” might be standing in for — what kind of feeling or experience they might be trying to give shape to."
1,GPT-5,Psychodynamic,"That sounds very painful — to dread the very thing that’s meant to restore you. It’s understandable that you’d struggle to let yourself drift off if you’ve come to expect something frightening waiting for you there.
Nightmares often carry powerful emotional material that our waking minds can’t quite hold during the day. They can be the psyche’s way of trying to work something through — even if it feels unbearable in the moment.
When you think about the nightmares, is there one that tends to return, or a theme that feels familiar each time? Sometimes noticing those patterns can give us a sense of what your mind might be trying to express through them."
1,GPT-5,Psychodynamic,"It sounds as though you never really get to let go — even in sleep. Almost as if a part of you is keeping vigil through the night, unwilling or unable to fully hand things over to rest. That must be incredibly draining, to wake up each morning feeling as though you haven’t truly slept at all.
I’m wondering what it might be like for that part of you — the one that stays half-awake, watching. What do you imagine it’s guarding against, or trying to protect you from?
Sometimes, when we’ve had experiences where we needed to be alert to stay safe, the body and mind can hold on to that stance long after the danger has passed. Does any of that resonate with you — the idea of having once needed to stay vigilant?"
1,GPT-5,Psychodynamic,"It sounds like you’ve found a way to soothe yourself when things feel too intense — almost like giving your mind something to hold onto so it doesn’t drift into those frightening places. That shows a lot of resourcefulness on your part.
And I hear your frustration too — this sense that you shouldn’t have to keep fighting for rest, that sleep ought to come naturally, without all this effort. There’s something quite painful about feeling you have to keep defending yourself, even at night.
I’m curious about that word you used — shouldn’t. What do you imagine it would mean about you, or about your situation, if you could finally sleep without needing those distractions?"
1,GPT-5,Psychodynamic,"It sounds like there’s a tension building for you around your friends — so much so that it becomes easier to step back than to face it. That can feel confusing, especially if you don’t know why the anxiety is arising.
Sometimes, our relationships can stir up feelings that echo experiences from the past — old fears, worries about being judged, or even a sense of not being safe. I wonder, when you notice that anxiety around your friends, what kind of thoughts or images come up for you? What does your body feel like in those moments?
Exploring that might help us understand what’s beneath the surface, the part of you that seems to be holding back."
1,GPT-5,Psychodynamic,"That sounds like a heavy feeling to carry — this sense that, despite appearances, people around you might not truly like you. I can imagine it would make being with them tense and exhausting, and it makes sense that you’d want to withdraw at times.
Sometimes, these thoughts can reflect fears that go deeper than the friendships themselves — perhaps feelings we’ve experienced earlier in life about acceptance, belonging, or being seen. I’m curious what it feels like inside when you think your friends don’t like you. Is it fear, sadness, shame… or something else?
Noticing that feeling closely can help us begin to understand what part of you is speaking through these thoughts."
1,GPT-5,Psychodynamic,"It sounds as though home has become a kind of sanctuary for you — a place where you can finally exhale a little, where the world feels more contained and predictable. There’s a real poignancy in how you describe it — a “den,” a “hideout.” It suggests both comfort and protection, but also perhaps a sense that something outside still feels unsafe or threatening.
I’m wondering what it’s like for you to imagine stepping out of that den — not necessarily in practice, but emotionally. Does it bring a particular feeling or image to mind?
Sometimes, when our inner world feels uncertain or fearful, we look for spaces that help us feel shielded. And often, those fears — the sense that “something is out to get me” — can carry meanings that aren’t entirely about the external world, but perhaps about old experiences of vulnerability or danger.
Would it feel okay to explore together what “safe” and “unsafe” have meant for you, both now and earlier in your life?"
1,GPT-5,Psychodynamic,"That makes a lot of sense in light of what you’ve been describing — a mind that’s alert, vigilant, almost always scanning for danger. Rehearsing conversations can feel like a way to prepare, to protect yourself, to anticipate what might go wrong before it actually happens.
I’m curious — when you rehearse these conversations, what kinds of things tend to occupy your mind? Is it mostly worries about how others will react, or something else?
Noticing that pattern closely can sometimes help us understand what part of you is trying to stay safe, and what feelings or fears it might be holding onto underneath all the planning."
1,GPT-5,Psychodynamic,"Thank you for sharing that. That fear — of embarrassing yourself in front of people you know — can feel very immediate and intense. It makes sense that you’d want to rehearse conversations, protect yourself, and even retreat at times.
I wonder what it is about embarrassment that feels so threatening to you. Sometimes, feelings like this can be linked to experiences from earlier in life — moments when we felt judged, exposed, or vulnerable. Do any memories or images come up for you when you think about that fear?
Exploring where it comes from can help us understand why it feels so urgent now, and what the part of you trying to prevent it might actually need."
1,GPT-5,Psychodynamic,"It sounds like your body reacts strongly when you’re in those larger social settings — palpitations can be quite alarming, can’t they? They feel like a signal that your mind and body are on high alert, even if, on the surface, there’s no immediate danger.
I’m curious about what’s happening internally in those moments — what thoughts, images, or feelings seem to accompany the palpitations? Sometimes our bodies give us very vivid signals about the tension or fear that we’re experiencing, and paying attention to them can help us understand what part of you is feeling threatened or exposed.
Would you like to explore what that part of you might be trying to protect, or communicate, in those situations?"
1,GPT-5,Psychodynamic,"That sounds like a painful tension — wanting to connect with others, but feeling held back by anxiety, and then worrying about how that might appear to them. It’s understandable that you’d feel misunderstood in those moments.
I wonder what it’s like for you internally when that anxiety takes over — what thoughts or sensations arise, and how it feels to carry that while trying to navigate social situations. Sometimes noticing those patterns closely can give us insight into what your anxiety is trying to protect you from, even if it ends up creating discomfort in its own way.
It also seems there’s a part of you that longs to be seen differently, as more relaxed or open. What do you notice about that part of you?"
1,GPT-5,Psychodynamic,"It sounds like there’s a real sense of loss there — losing contact with people who once mattered to you, even if it happened gradually. It also seems tied to the anxiety you’ve described: the excuses, the withdrawing, the self-protection. That pattern must feel both relieving in the moment and painful in the long term.
I wonder what it was like inside for you when you made those excuses — what feelings or fears were present that made it feel safer to step back? Sometimes, understanding that internal experience can help us see the connection between the anxiety, the withdrawal, and the sense of loss you’re carrying now.
What comes up for you when you think about those friendships and the distance that’s grown between you?"
1,GPT-5,Psychodynamic,"That makes a lot of sense in light of what you’ve been describing — a mind that’s on high alert, scanning for danger, and body that reacts strongly in social or crowded settings. Even something as ordinary as a supermarket can feel like a space full of unpredictable stimuli, which would naturally be overwhelming.
I’m curious about what’s happening inside when you’re there — what sensations, thoughts, or images tend to arise that make it feel safer to go at quieter times? Sometimes noticing those details can give us insight into what your anxiety is trying to signal or protect you from.
It also seems like your home and those quiet hours function as a kind of refuge. I wonder what it feels like when you step out of that safety, even briefly — what comes up inside you in those moments?"
1,GPT-5,Psychodynamic,"That sounds like a really difficult tension to live with — knowing that isolation isn’t what you want, but feeling that being around people takes so much energy and stirs so much anxiety. It makes sense that you would retreat; your mind and body are trying to protect you from overwhelm.
I wonder what it’s like for you emotionally when you’re alone versus when you’re with others. Are there particular feelings that arise in one setting that don’t in the other? Sometimes exploring that contrast can help us understand what your nervous system is trying to manage, and what it’s asking for when it seeks safety in solitude.
Even noticing this tension — between connection and self-protection — can give us a starting point for understanding the deeper needs beneath your anxiety."
1,GPT-5,Psychodynamic,"That sounds exhausting — to spend twice as long worrying about whether it’s good enough as actually doing the work itself. It seems like your mind really amplifies the stakes, making the act of completing something feel tense and fraught.
I’m curious about what goes through your mind during those hours of stress. What kinds of thoughts or images come up when you’re questioning whether it’s “good enough”? Sometimes those moments reveal underlying fears — perhaps about judgment, making mistakes, or how others will see you — that are very familiar from earlier experiences.
What do you notice about yourself in those times, as you’re caught between doing and worrying?"
1,GPT-5,Psychodynamic,"That’s a very insightful observation — noticing that your sense of self-worth is tied so closely to your work and salary. It makes sense that you’d feel so much pressure and anxiety around tasks like the report you just described; when success or approval feels bound up with who you are, every small action can feel monumental.
I wonder what it’s like inside when you feel your worth measured this way. Does it bring anxiety, self-criticism, fear of judgment, or something else? Often, these feelings can trace back to earlier experiences where we learned that our value was conditional, dependent on achievement or performance.
If it feels safe, we could explore together where that connection between your work and your self-worth first started to take shape."
1,GPT-5,Psychodynamic,"That sounds really painful — feeling like you’re constantly struggling while others seem to navigate the same tasks with ease. It makes sense that it would leave you feeling frustrated, exhausted, or even inadequate.
I wonder what it is inside you that notices the contrast so sharply — what feelings come up when you see others doing things seemingly effortlessly? Sometimes these comparisons can awaken older experiences of feeling behind, not enough, or under pressure to perform.
It might be helpful to explore what part of you is so hard on yourself in these moments, and what it’s trying to protect you from or achieve. What do you notice about that part when these thoughts arise?"
1,GPT-5,Psychodynamic,"Thank you for sharing that honestly. Jealousy can be a very powerful and uncomfortable feeling, especially when it comes to something tied to recognition or status at work — something that, as you mentioned earlier, is connected to your sense of self-worth.
It’s understandable that these feelings could make you vilify your colleague in your mind; sometimes our minds try to make sense of uncomfortable emotions by creating a kind of narrative around them.
I wonder what it’s like inside when those feelings of jealousy arise. Are there particular thoughts or memories that get stirred up when you notice her promotion, or is it more of a general sense of unfairness or self-criticism? Exploring that could help us understand what deeper needs or vulnerabilities are being touched."
1,GPT-5,Psychodynamic,"That sounds like a heavy standard to carry — this sense that if something can’t be perfect, it’s not worth even trying. I can imagine how exhausting it must be, especially when so much of your self-worth feels tied to achievement and how others perceive you.
I wonder what it would feel like inside if you allowed yourself to do something less than perfect. What fears, images, or sensations come up when you imagine that possibility?
Sometimes that drive for perfection is a way of protecting yourself — from criticism, disappointment, or the feeling of not being enough. Noticing what that part of you is guarding against can be a first step toward easing the pressure."
1,GPT-5,Psychodynamic,"It sounds like there’s a very critical part of you that steps in immediately after you finish something — focusing on what could have been better rather than allowing yourself to feel satisfaction or pride. That constant self-criticism must be exhausting.
I wonder what it would be like for you to notice that part of you — the one that’s always judging — and to ask what it’s trying to do. Often, these internal critics are trying to protect us from failure, disappointment, or judgment, even if their way of doing it ends up making life harder.
When you think about not congratulating yourself, what feelings or fears come up? Could there be a deeper worry about being “good enough” or accepted as you are?"
1,GPT-5,Psychodynamic,"Thank you for sharing that. It sounds like your parents’ high expectations have left a lasting imprint on how you see yourself and your achievements. That constant sense of needing to measure up, and the feeling of disappointing them, can create a lot of pressure and self-criticism — the very patterns you’ve been describing in work, social situations, and even sleep.
I wonder what it was like for you as a child trying to meet those expectations. How did it feel when you succeeded, and how did it feel when you fell short? Sometimes exploring those early experiences can help us understand why the inner critic is so active and why it hits so hard now.
What comes up for you when you think about that part of you that’s still trying to live up to their standards?"
1,GPT-5,Psychodynamic,"It sounds like there’s quite a painful split inside — one part of you that inflates the importance of what you’re doing in the moment, almost to give it weight and meaning, and another that then swings the other way and tells you you’re “useless” or unimportant. That kind of inner back-and-forth can be draining and confusing.
I wonder what it feels like when you’re in each of those states — the part that’s striving, convincing itself that the task really matters, and the part that deflates you afterward. Do they feel like familiar roles, perhaps echoing something from earlier experiences of needing to prove your value or fearing it could be taken away?
Often, beneath that oscillation between inflation and deflation is a very tender need — to feel seen as inherently valuable, not just for what you produce. I’m curious how that idea sits with you: being valued simply for who you are, not what you achieve."
1,GPT-5,Psychodynamic,"It makes sense that you’d feel jealous when you see your friends in roles that seem more enjoyable or rewarding. Those feelings can be painful, especially when you feel there’s no way to measure or prove them — it can leave you with a sense of inadequacy or self-comparison that’s very hard to shake.
I wonder what it’s like inside when that jealousy arises. Is it mostly a feeling of unfairness, self-criticism, or longing for something different in your own life?
Sometimes jealousy points to deeper desires or unmet needs — not just about the external circumstances, but about what we want for ourselves in terms of recognition, fulfillment, or feeling competent. Noticing what your envy is really signaling can help us understand what’s beneath it, rather than letting it just feel like a source of guilt or frustration."
1,GPT-5,Psychodynamic,"That sounds really painful — to achieve or be recognized and still feel as though it’s never enough. I can hear how exhausting it must be to constantly push yourself, only to feel that the bar is always moving higher.
I wonder what it is inside you that keeps saying “not enough.” Does it feel like a part of you is never satisfied, or is it more like a fear of being judged if you relax and accept your accomplishments?
Often, this inner voice is connected to earlier experiences of needing to prove yourself or meet expectations — sometimes from childhood — and it can become very persistent in adult life. Noticing where it comes from and what it’s trying to protect you from can be a first step toward giving yourself some relief.
What do you feel when you imagine truly allowing yourself to accept your successes as enough, even just a little?"
1,GPT-5,Psychodynamic,"Thank you for sharing that. It sounds like, even though your partner is supportive and helpful, there’s a part of you that remains on edge — a small but persistent fear that they might be unfaithful. That can create tension and anxiety in a relationship, even when there’s no concrete reason to worry.
I wonder what comes up inside you when that fear appears. Is it mostly a sense of vulnerability, past experiences of betrayal, or something else?
Sometimes these fears aren’t only about the present relationship but can echo earlier experiences where trust was fragile, or where you felt uncertain about being safe or valued. Exploring where this part of you learned to anticipate harm or betrayal can help us understand its message and need.
What do you notice in your body or mind when this worry shows up?"
1,GPT-5,Psychodynamic,"It sounds like there’s a real uncertainty for you about the relationship — even after three years, you’re still questioning whether this is truly what you want. That ambivalence can feel unsettling, especially when you care for your partner and they care for you.
I wonder what it is inside you that hesitates or holds back from fully committing to an answer. Are there particular fears, expectations, or needs that make you pause?
Sometimes, this kind of uncertainty points to a deeper process — trying to understand not just the relationship itself, but what you truly need and value in connection with another person. Exploring that can help you distinguish between what is about the relationship and what is about your own internal sense of readiness or desire.
What feelings arise when you imagine either staying in the relationship fully or stepping away?"
1,GPT-5,Psychodynamic,"That’s a very honest observation — noticing that as closeness grows, a part of you instinctively pulls back. Describing it as being “intimately shy” captures both the desire for connection and the fear or hesitation that comes with it.
I wonder what it’s like inside when that part of you retreats. Are there particular thoughts, images, or sensations that come up as intimacy approaches?
Often, pulling away can be a way of protecting yourself from vulnerability or potential hurt — a signal that something inside is wary of being exposed. Exploring what that part is afraid of, and what it might need to feel safe, can help us understand these patterns without judgment.
What do you notice about the tension between wanting closeness and feeling the need to withdraw?"
1,GPT-5,Psychodynamic,"That’s a very important question, and it shows you’re really trying to tune in to your feelings. There can indeed be a difference — “love” can carry warmth, care, and attachment, while “being in love” often includes passion, desire, and a sense of excitement or intensity.
I wonder what it feels like for you when you notice each of these — the love versus being in love. Are there particular moments with your partner that feel more distant, or times when the warmth and care feel strong?
Sometimes, exploring the nuances of these feelings can help us understand what’s shifting inside, what needs or desires are emerging, and what might be influencing your ambivalence.
What comes up for you when you think about that difference between loving someone and being in love with them?"
1,GPT-5,Psychodynamic,"It sounds like that argument left you feeling frustrated or drained, especially since it felt like it was “over basically nothing.” Sometimes, when tensions have been building — whether from stress, anxiety, or unspoken feelings — even small triggers can ignite a bigger reaction than expected.
I wonder what it was like for you emotionally in that moment. Were there underlying feelings — perhaps frustration, fear, or a sense of being misunderstood — that made the argument feel larger than the immediate issue?
Exploring what’s really beneath these arguments can often reveal patterns in the relationship or within ourselves that might not be obvious at first glance. What do you notice about your feelings before, during, and after these conflicts?"
