vignette_id,model,modality,response
1,GPT-4,Psychodynamic,"That fear makes a lot of sense — it sounds like there’s a part of you that worries your authentic self might not be acceptable or lovable, and that stepping fully into who you are could risk losing the relationship. That’s a heavy tension to carry.
I wonder what it’s like inside when that fear arises. Is it shame, vulnerability, or something else that feels so threatening?
Often, this worry reflects earlier experiences where being truly seen felt risky or where acceptance felt conditional. Noticing that part of you, and what it’s trying to protect, can help us explore ways to feel safer being authentic while still maintaining connection.
What do you feel might happen if you allowed yourself to show more of your true self with your partner?"
1,GPT-4,Psychodynamic,"That’s a very honest and vulnerable thought to share. It sounds like there’s some uncertainty about your motivations — whether the relationship is about genuine desire or about avoiding loneliness. That’s a painful tension to carry, and it makes sense that it can leave you feeling conflicted.
I wonder what it feels like inside when you notice that fear of being alone. Are there particular sensations, images, or memories that come up?
Sometimes, exploring that fear can reveal how past experiences of connection, loss, or vulnerability shape our present choices. Understanding it can help distinguish what you truly want from what feels like a way to feel safe.
What comes up for you when you imagine being on your own, even just in thought?"
1,GPT-4,Psychodynamic,"It sounds like there’s a tension inside you — part of you wanting closeness, and another part hesitating, even finding reasons to delay. You describe it as sabotaging, which suggests you notice a pattern where fear or anxiety gets in the way of the relationship moving forward.
I wonder what it is inside that pulls you back when the idea of living together comes up. Is it fear of losing autonomy, fear of being too exposed, or perhaps something else?
Often, these hesitations point to a part of us that’s trying to protect itself from vulnerability or potential hurt. Exploring what that part is afraid of can help us understand why the pull to delay feels so strong, without judging yourself for it.
What do you notice about your feelings when you imagine actually taking that step?"
1,GPT-4,Psychodynamic,"It sounds like seeing your friends’ relationships can stir up feelings of comparison and longing — a sense that others are happier or living more fulfilling lives. That can be painful, especially when your own relationship feels uncertain or fraught with anxiety.
I wonder what it is inside you that notices those posts so sharply — is it a sense of missing out, a feeling of inadequacy, or perhaps a combination of both?
Sometimes, these comparisons highlight unmet needs or desires within ourselves — for connection, joy, or affirmation — rather than pointing to what’s “wrong” with our lives. Exploring what these feelings are really signaling can help us understand what you truly want and need, rather than just measuring against others.
When you notice these posts, what comes up for you emotionally and physically?"
1,GPT-4,Psychodynamic,"It sounds like you’re really grappling with uncertainty — questioning whether your expectations are placing an impossible standard on the relationship, or whether it genuinely isn’t fulfilling what you need. That ambivalence can feel heavy and confusing, especially when you care about your partner and the relationship.
I wonder what it’s like inside when you consider each possibility. Are there particular fears or feelings that arise when you think the relationship might not be right? And what comes up when you think about whether your expectations might be high?
Sometimes, sitting with that tension — exploring what each part of you wants, fears, or needs — can help clarify what’s really at the heart of your uncertainty.
What do you notice about your feelings when you allow yourself to consider both possibilities?"
1,GPT-4,Psychodynamic,"It sounds like there’s a lot of pressure you’re feeling — both from yourself and, perhaps, from comparing yourself to others — about having your life “figured out” by now. That can feel heavy, frustrating, and even discouraging, especially when it seems like everyone else has clarity that you don’t.
I wonder what it feels like inside when you notice that comparison. Is it shame, anxiety, self-criticism, or something else?
Sometimes, this sense of uncertainty can point to deeper questions about identity, purpose, or the expectations we’ve internalized from earlier in life — from family, peers, or society. Exploring what those pressures are really about, and what you genuinely want or need, can be more helpful than measuring yourself against others.
What comes up when you allow yourself to imagine a life guided by your own desires rather than by comparison?"
1,GPT-4,Psychodynamic,"That sounds like a very painful realization — to look at your life and feel almost estranged from the person you see there. It can be deeply unsettling, as though something essential has drifted out of view without you quite noticing when it happened.
I wonder what it feels like, in your body or your emotions, when that thought arises — “When did I become this person?” Is there sadness, anger, confusion, or perhaps a kind of numbness?
Often, moments like this come when we’ve spent a long time adapting — working hard to meet expectations, to manage fear, to stay safe — and somewhere along the way our own desires and sense of self get pushed into the background. This recognition can be painful, but it can also be the beginning of reconnecting with the parts of you that have gone quiet.
If you were to imagine the version of yourself you feel you’ve lost touch with, what is she like? What qualities or feelings do you associate with her?"
1,GPT-4,Psychodynamic,"That sounds very heavy — to feel as though you’re just existing rather than living, and even when you reach for something that might bring you joy, guilt steps in and takes it away. It’s as though there’s a part of you that won’t allow you to fully relax or enjoy without some kind of self reproach.
I’m curious about that guilt. When it appears, what does it seem to be saying to you — what message or rule is it enforcing? Often, guilt around pleasure or leisure can trace back to early experiences where rest, joy, or self focus were seen as indulgent, selfish, or undeserved.
If you listen closely to that guilty part of you, what do you think it’s trying to protect? And on the other side, what might the quieter part of you — the one that longs for genuine enjoyment — be wanting or missing right now?"
1,GPT-4,Psychodynamic,"That’s a very honest realization — that the path you chose, though practical and sensible, hasn’t brought the fulfillment you hoped for. It can feel disappointing, even heavy, to recognize that something so central to your life isn’t aligned with what truly makes you happy.
I wonder what it feels like inside when you notice that — is it regret, frustration, sadness, or perhaps a mixture of many feelings?
Often, when we make choices based on logic, expectations, or security rather than desire, a part of us can remain unfulfilled. Exploring what was valued or feared at the time you made this choice can help us understand why it felt “right” then, and what might be missing now that you’re seeking.
If it feels safe, what would it mean for you to start imagining a career or path that could bring a sense of purpose or enjoyment?"
1,GPT-4,Psychodynamic,"It sounds like work has become something you move through almost mechanically — your mind and body on “auto-pilot” — and that afterwards you’re left drained and unmoored. That must feel exhausting, as though there’s no space left for yourself once the day is done.
I wonder what it’s like inside when you notice that autopilot state. Are there particular thoughts, feelings, or sensations that arise as you go through the motions?
Sometimes, operating this way is a way of coping with anxiety, pressure, or fear of not being “good enough” at work. It can protect us in the moment, but it comes at the cost of leaving us depleted and disconnected from what might bring meaning or rest.
What part of you do you notice wants something different — more engagement, rest, or satisfaction — at the end of the day?"
1,GPT-4,Psychodynamic,"Hearing you ask, “Is this all there is?”… that carries a lot of weight. It sounds like there’s a deep sense of longing — a feeling that life has become repetitive, exhausting, or empty, and that what you’re experiencing day to day isn’t enough.
I wonder what comes up inside when you ask that question. Is it sadness, frustration, emptiness, or perhaps a mixture of many feelings?
Sometimes, questions like this can be a way your inner self is reaching out, trying to signal that it wants more meaning, connection, or vitality — that there’s a part of you that senses life could feel fuller or truer to who you are.
If you allow yourself to listen closely to that part of you, what do you imagine it might be yearning for?"
1,GPT-4,Psychodynamic,"That sounds really painful — to feel disconnected from the dreams and ambitions that once gave you direction or excitement. It’s as if life’s pressures, responsibilities, and the weight of anxiety have pushed those parts of you into the background, making them hard to access.
I wonder what it feels like when you try to remember them — is there sadness, frustration, or maybe even a sense of emptiness?
Sometimes, reconnecting with those earlier ambitions isn’t about forcing yourself to remember every detail, but about noticing what qualities or feelings they evoked in you — curiosity, creativity, hope, or a sense of possibility.
If you allow yourself to imagine those dreams again, even in a small way, what comes up for you?"
1,GPT-4,Psychodynamic,"That sounds incredibly stressful — to be confronted with these long-term expectations when even the near future feels overwhelming. It makes sense that thinking in terms of years ahead would feel impossible when the immediate weeks are already so hard to navigate.
I wonder what it’s like inside when people ask about your five-year plan. Do you notice anxiety, self-criticism, or perhaps a sense of being inadequate?
Sometimes, the pressure to have a clear plan can amplify the sense that you’re falling short or that life is moving faster than you can manage. Exploring how it feels to focus on the very next step — rather than the entire horizon — can help uncover what your inner self truly needs and wants.
What do you notice about yourself when you allow your attention just to the next day or week, instead of trying to map out years ahead?"
1,GPT-4,Psychodynamic,"That sounds like a really heavy feeling — the sense of being overwhelmed by big questions about your life, and the worry that maybe you’ve already lost precious time. It’s such a painful thought, and it often comes with a mixture of regret, sadness, and fear about what the future might hold.
When you sit with that feeling of having wasted time, what does it feel like inside? Is it more of a grief for what could have been, or a fear that it’s now too late to change things?
Often, these moments of reckoning come not because we’ve truly wasted time, but because a part of us is waking up — noticing that something isn’t aligning, that something deeper wants to be lived. The very fact that you’re reflecting on this suggests movement, not stagnation.
If you imagine this overwhelmed part of you having a voice, what do you think it might be asking for right now — understanding, reassurance, direction, or maybe permission to start again?"
1,GPT-4,Psychodynamic,"That’s a very honest and important observation — noticing the tension between what you truly want and what you feel you should want. That can be a subtle but powerful source of anxiety, dissatisfaction, and self-doubt.
I wonder what it feels like inside when you notice that distinction. Are there particular thoughts, sensations, or emotions that arise when you consider what you really desire versus what you think is expected of you?
Often, this tension points to the influence of early experiences, societal pressures, or internalized expectations — all of which can shape our sense of what we “should” do. Exploring those layers can help us understand where your authentic desires might be waiting to be heard.
If you let yourself imagine a life guided by your own genuine wants, rather than expectations, what feelings come up for you?"
