vignette_id,model,modality,response
1,GPT-4,CBT,"I hear the weight in that question — it sounds like you’re feeling exhausted, stuck, and maybe questioning the meaning or direction of your life. That’s a very human place to be when anxiety, self-criticism, and pressure have dominated for so long. It can feel like life is just a cycle of stress, obligations, and exhaustion, and that can be deeply discouraging.
From a CBT perspective, one way to approach this is to explore what’s missing versus what’s possible:
1.	Identify what feels empty or lacking – Are there areas where you’d like more meaning, connection, or fulfillment?
2.	Notice small sparks of purpose or pleasure – Even tiny moments can be clues to what makes life feel more alive.
3.	Set manageable experiments – Rather than waiting for life to “change completely,” we create small, intentional steps to bring more engagement, satisfaction, and agency into your daily experience.
The fact that you’re asking this question is meaningful — it shows awareness and a desire for something more. You don’t have to figure out everything at once; we can start by identifying one small area where a shift could be possible and build from there.
Would you like to start by exploring one part of your life that might bring a sense of purpose or fulfillment if approached differently?"
1,GPT-4,CBT,"That sounds really painful — losing touch with your dreams and ambitions can make life feel heavy, like you’ve been running on survival mode for so long that your own desires have faded into the background. That’s actually a common experience for people dealing with chronic anxiety, stress, or self-criticism: the energy that used to go toward curiosity and exploration gets consumed by coping and protecting yourself.
In CBT, one approach is to reconnect with values and past interests rather than trying to force old dreams to reappear immediately:
1.	Recall past moments of excitement or curiosity – Even small things you enjoyed or felt passionate about as a teen or young adult can give clues to what truly matters to you.
2.	Explore present interests – Notice what sparks even a tiny sense of engagement or enjoyment now, without judging it as “big enough” to be a lifelong dream.
3.	Experiment and reflect – Trying small activities related to these interests can help you rediscover what matters and gradually build a sense of direction.
A simple first step could be listing three things you used to enjoy or feel curious about — anything, no matter how small or distant — and seeing what feels appealing to explore again.
Would you like to do that together now?"
1,GPT-4,CBT,"That makes complete sense — it can feel overwhelming to think about a five-year plan when even the next week feels unmanageable. What you’re experiencing is very common for people who have a lot of anxiety, self-criticism, or perfectionism: the mind is so focused on immediate survival or coping that long-term planning feels impossible.
In CBT, we often approach this by breaking large, vague goals into very small, manageable steps:
1.	Focus on the immediate – Start with what’s realistic to think about or plan for the next day or week. That reduces overwhelm.
2.	Gradually expand – Once the immediate week feels more manageable, slowly consider the next month, then the next six months. Small increments build confidence and clarity.
3.	Shift the definition of “planning” – Planning isn’t about having a perfect roadmap; it’s about exploring possibilities, identifying priorities, and experimenting to see what works.
We could start by thinking about just the next week — what’s one thing you’d like to achieve or experiment with that feels doable? That can help you take the pressure off long-term thinking while still moving forward."
1,GPT-4,CBT,"That sounds like such a heavy place to be — when you look back and wonder if you’ve “wasted” time, it can fill you with regret and panic about the future. Many people feel this way when they’ve been in survival mode for a long time; your energy’s gone into coping and staying afloat, not into long-term planning or fulfilment. That’s not wasted time — that’s you getting through.
From a CBT perspective, it can help to gently separate emotional conclusions from factual reality:
1.	Recognize the thought pattern – “I’ve wasted the last few years” is a thought, not an objective fact. It’s your mind’s way of expressing disappointment and frustration.
2.	Reframe the meaning of that time – What if those years were about learning what doesn’t fit for you, or about developing resilience, patience, or self-awareness? Growth isn’t always visible while it’s happening.
3.	Focus on the next small step – When life feels overwhelming, narrowing the focus to one actionable, meaningful thing you can do this week can make the future feel more navigable.
You might try a short exercise:
Write down three things the past few years have taught you — even if they came from difficulty. Then, one small thing you’d like to do differently moving forward. It’s a way of shifting from “I’ve wasted time” to “I’ve been learning, and I can start steering things now.”
Would you like to go through that reflection together?"
1,GPT-4,CBT,"That’s a really important and honest reflection — it shows a deep awareness of your own thoughts and motivations. When anxiety, self-criticism, and external expectations are strong, it’s very easy to drift into living a life shaped by what you think you should do rather than what truly resonates with you. That disconnection can leave you feeling unfulfilled, lost, and exhausted.
In CBT, we often approach this by:
1.	Identifying your values – What matters most to you, independent of others’ expectations? This could be creativity, connection, autonomy, learning, or anything meaningful.
2.	Comparing life choices to values – Looking at your current routines, work, and relationships: do they reflect what you truly care about, or what you feel pressured to pursue?
3.	Small experiments – Testing out choices or activities that align with your values, even in small ways, to see how it feels and gradually build a life that feels authentic.
A simple exercise we could start with is listing 3–5 core values or things that truly matter to you, then reflecting on which parts of your life align with them and which don’t. That often brings clarity and direction without overwhelming you.
Would you like to try that now?"
