vignette_id,model,modality,response
1,GPT-4,CBT,"That sounds really tough, when sleep has been difficult for a while, it can start to affect everything else.
Can you tell me a bit more about what has been happening with your sleep. For example, are you finding it hard to fall asleep, waking up during the night, or waking up earlier than you’d like
And when you are lying there awake, what tends to be going through your mind"
1,GPT-4,CBT,"That sounds really exhausting — it’s like your mind gets busier just when you want it to switch off. Many people find that pattern very frustrating.
Let’s slow it down a little. When your thoughts start racing, what kinds of things do they tend to focus on? Are they more about the day that’s just passed, things you need to do tomorrow, or something else entirely?
It can help us understand the pattern — and from there, we can look at some ways to manage those thoughts so they don’t take over at night."
1,GPT-4,CBT,"That sounds really unsettling — lying there and feeling that sense of threat would make it almost impossible to rest. I can hear how distressing that must feel for you.
When that feeling comes up, do you notice any changes in your body — for instance, your heart rate, breathing, or muscle tension? Sometimes our body gives us clues about how intense that fear feels in the moment.
And I wonder, when you sense that “something evil is on its way,” how certain does that feel to you right then — like it’s definitely happening, or more like a powerful worry that something might happen?"
1,GPT-4,CBT,"That sounds really difficult — it’s as if your body’s on high alert, even when you’re meant to be resting. It makes sense that you’d feel tense and on edge if your mind and body are constantly scanning for signs of danger.
It might help if we explore this from two angles: what’s happening physically and what’s happening mentally. Physically, your body seems to be reacting as though it needs to stay safe — almost like it doesn’t quite trust it’s okay to switch off. Mentally, it sounds like there’s a sense of threat that keeps you alert.
Could we take a moment to look at what goes through your mind in those moments when you wake up and start scanning? What thoughts or images come up first?"
1,GPT-4,CBT,"It sounds like you’ve really been putting in effort to try to manage this on your own — that tells me how much you want things to change, even though it’s been discouraging that nothing seems to make a lasting difference.
When someone’s system has been in “alert mode” for a while, things like meditation or cutting caffeine can help a bit, but often they don’t reach the core belief or sense of threat that keeps the body wired. So rather than more “doing,” we might look at gently retraining your mind and body to feel safe again at night.
Can I ask — when you do wake up and notice that scanning, what do you tend to do next? Do you get up, check things, or stay in bed trying to calm yourself down?"
1,GPT-4,CBT,"That sounds incredibly draining — being worn out all day but still unable to rest at night can start to feel like a vicious cycle. Your body is crying out for rest, yet your mind doesn’t seem to get the message that it’s safe to let go.
Often what’s happening in that pattern is that your body has learned to associate nighttime — or the quiet of lying in bed — with danger or threat. So instead of winding down, the brain interprets it as a cue to stay alert. It’s not something you’re choosing; it’s more like your threat system is trying to protect you, even though it’s misplaced.
What we can do together is help your mind and body learn that bedtime is safe again. That usually involves a mix of grounding or calming techniques and gently challenging the thoughts that keep you on alert.
Would you be open to trying a brief grounding exercise now — just to see how your body responds — before we talk about some ways to use it at night?"
1,GPT-4,CBT,"That sounds very distressing — those kinds of intrusive images can feel so vivid and convincing in the moment, even though you know they’re not real. It makes sense that you’d hate having them and that they’d keep you on edge.
What you’re describing is something many people experience when the mind is under strain or when the threat system has been active for a while. The brain starts to create images as if it’s trying to prepare you for danger, even when no real danger is present. It’s the brain’s way of “protecting,” but it ends up frightening you instead.
Rather than trying to push these images away — which often makes them come back stronger — we can practise noticing them differently, in a more observing way. It’s about recognising, “This is my mind showing me a scary picture, not an actual event.”
Would you be open to exploring a way of responding to these images when they appear, so they start to lose their power over you?"
1,GPT-4,CBT,"That sounds really painful — it’s understandable that you’d dread going to bed if night after night brings frightening dreams. When that happens often, it can feel like there’s no safe space, not even in sleep.
Nightmares are the mind’s way of replaying or processing a sense of threat. They often carry the same themes as your waking fears — being under attack, feeling unsafe, feeling powerless. So it’s not that something’s “wrong” with you; it’s that your mind is trying, in a clumsy way, to make sense of those fears.
There are a few things we can do together for this. One is helping you prepare your body for rest, so you go to bed in a calmer state. Another is to work directly with the nightmares using a CBT technique called imagery rehearsal — where we gently change the ending or tone of a nightmare while you’re awake, retraining your brain to expect a different outcome. Over time, this can reduce both the frequency and intensity of the nightmares.
Would you like me to walk you through how that technique works, or would you prefer to start by focusing on how to calm your body before sleep?"
1,GPT-4,CBT,"That sounds exhausting — it’s like your body is sleeping, but your mind is still keeping watch. When that happens, it’s often because your system hasn’t had a real sense of safety for a while, so it stays on the edge of wakefulness, just in case.
You’ve been describing a pattern that makes a lot of sense from that perspective: racing thoughts, feeling on alert, vivid nightmares, and now this half-awake sleep. All of it points to your body trying to protect you from a danger that isn’t actually here now — but that feels very real in those moments.
One thing that can help is working gradually on teaching your body that it’s allowed to switch off again. We can do that through small steps: gentle breathing or grounding before bed, changing how you respond when those intrusive thoughts or images appear, and maybe creating a sense of predictability or comfort in your sleep routine so your brain starts to associate bedtime with safety rather than threat.
Before we go into any techniques, though, I’d like to check — when you do wake up or lie there half-awake, what do you notice first? Is it more a physical sense, like tension or alertness, or do the scary images and thoughts come in straight away?"
1,GPT-4,CBT,"I hear you — it makes sense that you’d feel frustrated. Using earphones and something to distract yourself shows resourcefulness, and it does help you get through the night. At the same time, it sounds like it’s not giving you the deep, restorative sleep you want, and relying on it constantly can feel like a compromise rather than a solution.
What you’re describing is actually quite common: when the mind is stuck in that hyper-alert state, we develop coping strategies just to survive the night. The goal in therapy isn’t to take away the strategies that do help, but to gradually reduce the need for them by addressing the thoughts and sensations that keep you on edge in the first place.
We can work together on techniques that help your mind feel safe enough at night that you don’t have to rely on constant distraction — so sleep can become more natural again.
If you’re okay with it, we could start looking at how to gently respond to the racing thoughts and intrusive images, so your brain starts learning that bedtime is safe and doesn’t need constant “protection.” That way, your coping strategies like earphones can become optional rather than essential.
Do you want to try a small exercise for that now?"
1,GPT-4,CBT,"Thank you for sharing that — it sounds like this anxiety is spilling over into your social life, which must feel frustrating, especially if you value your friendships.
It makes sense that when your nights are full of racing thoughts, hyper-alertness, and nightmares, your overall stress and tension during the day are higher. Anxiety in social situations can often flare up when your system is already on edge — even if there isn’t an obvious reason in the moment.
It might help to look at what goes through your mind just before or during social situations. Often, there are automatic thoughts — like, “I’m not going to be okay,” or “Something bad could happen” — that increase anxiety. Once we identify those thoughts, we can gently test them against reality and look at small steps to make social situations feel safer and more manageable.
Could you tell me what usually goes through your mind when you think about meeting your friends right now?"
1,GPT-4,CBT,"I hear you — that thought can feel very real and upsetting in the moment, and it makes sense that it would make you anxious about seeing them. When our minds are on high alert, it’s common to interpret neutral or even positive interactions as threatening or rejecting. It doesn’t mean the thought is true — it’s more like your brain is on the lookout for danger, even in friendships.
In CBT, one approach is to gently examine these thoughts and see what evidence there is for and against them. For example, have your friends ever shown signs that they enjoy your company, or reached out to spend time with you? Sometimes even small pieces of evidence can start to shift the sense of certainty around that worry.
Another technique is to notice the pattern of the thought rather than immediately trying to stop it. So instead of “I’m not liked,” you might label it as, “There’s a thought that I’m not liked,” which gives it less power over your feelings and behavior.
If you like, we can do a short exercise now to look at one of these thoughts and see what evidence there really is for it — just to practice seeing it more clearly. Would you like to try that?"
1,GPT-4,CBT,"That makes a lot of sense — home has become the one place where you feel some control, a bit of safety from that sense of threat. When the world outside feels unpredictable or unsafe, it’s natural to retreat somewhere that feels protected. It’s your mind’s way of saying, “Here, at least, I know what to expect.”
The tricky part is that, while staying home brings short-term relief, it can also quietly reinforce the message that the outside world is dangerous — and that can make the anxiety stronger over time. We don’t want to take away the sense of safety you’ve built, but we can help you expand it so you start to feel that same safety in other places too.
Would you say the feeling of being “unsafe” outside is more about people, places, or just a general sense that something bad could happen? That’ll help us understand what’s driving that protective instinct, and how to begin loosening its hold bit by bit."
1,GPT-4,CBT,"That’s something a lot of people do when they feel anxious — your mind is trying to “prepare” for a situation so that you don’t get caught off guard. It’s understandable, especially given the high-alert state you’ve described at night and during social interactions.
The problem is that rehearsing conversations can actually increase anxiety rather than reduce it, because your mind tends to focus on worst-case scenarios or things going wrong. You’re practicing what could go wrong instead of just experiencing what actually happens.
One approach we can try is called experimentation with thoughts: noticing the rehearsed scenario, labeling it as a thought rather than a prediction, and gently testing how realistic it really is. Over time, this can reduce the need to rehearse every conversation.
Would you like to take a specific conversation you’re worried about and see how we could apply that technique to it?"
1,GPT-4,CBT,"Thank you for being so open about that — that’s a very common worry, and it makes sense that it would weigh on you, especially if you’re already feeling anxious and on high alert. The fear of embarrassment often comes from a part of the mind that’s trying to protect you from social rejection, even if the risk is very small in reality.
In CBT, we often work on two angles with this kind of concern:
1.	Examining the evidence: What’s the real likelihood of the worst-case scenario happening? Often, when we break it down, it’s far less likely than the mind assumes.
2.	Gradual exposure: Slowly and safely practicing social interactions, starting with situations that feel only a little challenging, can teach your brain that embarrassment is tolerable — and that even if a small mistake happens, it’s not catastrophic. Over time, this reduces anxiety and the need to avoid or over-rehearse.
If you want, we can pick a recent situation where you worried about embarrassment and break it down together. That way, we can start seeing it more objectively and plan small steps to feel more confident in similar situations.
Do you have a specific example in mind?"
1,GPT-4,CBT,"That sounds frightening — feeling your heart racing in front of others can really amplify the anxiety, especially if you’re already worried about embarrassment. When we’re in a high-alert state, the body can respond as though there’s immediate danger, even when there isn’t. Palpitations are often part of that “fight-or-flight” response — your body gearing up to protect you.
It can be helpful to notice that the palpitations, while uncomfortable, are a normal physiological reaction and not dangerous. One technique we often use is grounding and controlled breathing in the moment: slowing the breath, feeling your feet on the ground, and observing the physical sensations without judgment. This helps signal to your body that you’re actually safe, which can reduce the intensity of the palpitations over time.
Would you like me to guide you through a brief exercise you could use the next time this happens at work? It can make these sensations feel a lot less alarming."
1,GPT-4,CBT,"That makes a lot of sense — when anxiety takes over, it can change how we come across to others, even though our intentions are the opposite. Many people in similar situations feel misunderstood, which can add another layer of stress.
Part of what we can work on is separating how you feel inside from how you assume others perceive you. Often, our anxious mind assumes the worst — that people see us negatively — but when we look at the evidence, most interactions aren’t actually interpreted that way by others.
We can also explore gentle strategies to manage anxiety in social situations so that it doesn’t interfere with your natural interactions. Small shifts in attention — like focusing on listening rather than analyzing how you’re coming across — can make you feel calmer and more connected.
Would you like to explore one or two practical ways to do that in your next social or work interaction?"
1,GPT-4,CBT,"Thank you for sharing that — it sounds painful, and it also takes a lot of honesty to reflect on it this way. Losing touch with people we care about can feel lonely, and the pattern of avoidance you describe makes sense given the anxiety you’ve been experiencing. Your mind has been trying to protect you from the discomfort of social interaction, but in doing so, it unintentionally reinforced the isolation.
In CBT, we often look at these patterns as safety behaviors: things we do to reduce anxiety in the short term that actually maintain it in the long term. In this case, avoiding contact reduced immediate stress, but it also prevented the evidence that your friends might still value your company.
We can start to gently explore steps to reconnect — even small ones, like sending a message or arranging a brief catch-up. The goal isn’t to overwhelm you, but to start creating experiences that gradually challenge the belief that you’re not liked or that social contact will be unbearable.
Would you like to think about one small, manageable step you could take toward reconnecting?"
1,GPT-4,CBT,"That makes a lot of sense — your mind and body are on high alert, so even everyday situations like a supermarket can feel overwhelming. Choosing quieter times shows that you’re trying to manage the anxiety in a practical way, which is a smart coping strategy, but it also reinforces the idea that the world is unsafe at other times.
In CBT, we often approach this by gently expanding your comfort zone — in very small, controlled steps — so that over time, your brain starts to learn that these situations aren’t actually dangerous. For example, you might start by going a little earlier or later than usual, but still during a time that feels manageable, and gradually work toward busier periods when you’re ready. Pairing that with grounding or calming techniques can make the experience much less overwhelming.
Would you like to explore a step-by-step way to approach situations like this, so you can slowly feel more comfortable without forcing yourself too quickly?"
1,GPT-4,CBT,"That’s completely understandable — when your system is in that heightened state of alert, being around people can feel like an intense demand on your energy. It’s not about you being “antisocial” or flawed; it’s your body and mind trying to protect you from perceived threats. That can make social contact exhausting and anxiety-inducing, even when you genuinely want connection.
In CBT, we often talk about balancing safety and exposure. Right now, staying home provides short-term relief, but it also reinforces the belief that being around people is dangerous or intolerable. The goal isn’t to push you into overwhelming situations, but to start taking small, manageable steps toward connection — ones that gradually show your mind that social situations can be tolerated, and even enjoyable.
We could start by identifying very small, low-pressure social steps — maybe a brief chat with someone you trust or a short errand with minimal interaction — and pair that with grounding techniques to keep your anxiety manageable. Over time, these small exposures can rebuild confidence and reduce the constant feeling of being “on guard.”
Would you like to work on planning a small, safe step you could try this week?"
1,GPT-4,CBT,"That really highlights how much mental energy you’re using on worry — it’s not just the work itself, but the anxiety around whether it’s “good enough” that’s taking up so much of your time. That kind of overthinking is exhausting, and it makes sense that it leaves you feeling drained.
In CBT, we often work on cognitive restructuring around perfectionism and worry. One approach is to break down those anxious thoughts and test them:
•	What’s the actual evidence that the report isn’t good enough?
•	What’s the realistic worst-case scenario if it isn’t perfect?
•	Have there been times in the past where work wasn’t perfect but it was still acceptable?
Another helpful technique is time-limited worry: giving yourself a set window to review or think about the report, and then consciously moving on once that time is up. That can prevent the worry from taking over hours of your day.
If you like, we could try breaking down one of the anxious thoughts you had about the report and see how realistic it really is — it often helps reduce the intensity of that stress."
1,GPT-4,CBT,"That’s a very honest insight, and it makes a lot of sense — if you feel that your work or salary defines your value, then any perceived shortcoming or stress at work can feel deeply personal and threatening. That’s a heavy burden to carry, and it can intensify anxiety, perfectionism, and self-criticism.
In CBT, we often work on decoupling self-worth from external measures. One approach is to start noticing the ways you do have value outside of work — your relationships, your creativity, your kindness, or any other strengths or achievements. Another approach is to gently challenge the thought: “If my work isn’t perfect or my salary isn’t what I want, does that actually mean I’m less worthy?”
It’s a gradual process, but over time it’s possible to build a sense of self-worth that’s more stable and less dependent on performance or external validation.
Would you like to explore one or two ways to start practicing this in daily life?"
1,GPT-4,CBT,"It’s completely understandable to feel that way — comparing yourself to others can make the struggle feel even heavier. But just because someone else seems to find things easy doesn’t mean they actually do; we rarely see the effort, doubts, or anxieties that go on behind the scenes.
In CBT, we often look at these comparisons as a form of cognitive distortion, sometimes called “mental filtering” or “discounting the positives.” Your mind is focusing on others’ apparent ease and your own struggles, which amplifies the sense of inadequacy.
One helpful approach is to shift from comparison to curiosity: “What strategies or support could help me handle this task more effectively?” or “What progress have I made, even if it feels slower than others?” Small acknowledgments of your own effort can reduce that pressure and self-criticism.
If you like, we can try an exercise where we break down one situation at work and identify both the challenges and the things you did well — it can help start to shift that perspective."
1,GPT-4,CBT,"Thank you for being so open about that — it takes a lot of courage to acknowledge feelings like jealousy and resentment. It’s very human to experience these emotions, especially when you feel overlooked or undervalued despite your hard work.
In CBT, we often explore these feelings by separating the emotion from the story your mind tells about it. Feeling jealousy is natural, but vilifying your colleague is your mind’s way of trying to cope with that uncomfortable feeling. If we can notice it without judgment, we can start to respond differently.
One approach is to reframe or challenge the thoughts that fuel the vilification. For example:
•	“Her promotion doesn’t erase my contributions or worth.”
•	“Feeling jealous is uncomfortable, but it doesn’t make me a bad person.”
We can also use these moments to explore constructive ways to manage the emotion, like reflecting on what you can control in your own work or setting goals for your next steps, rather than focusing on what you perceive as unfair.
Would you like to try breaking down the thoughts that came up around this promotion so we can see which ones are feeding the jealousy and how to approach them differently?"
1,GPT-4,CBT,"That’s a very honest reflection — it’s a mindset many people with high anxiety or perfectionistic tendencies experience. The thing is, while it feels protective in the moment (“If I don’t do it perfectly, I won’t fail”), it ends up keeping you from doing things at all and can increase anxiety, self-criticism, and feelings of inadequacy over time.
In CBT, we work on gradually challenging perfectionism by experimenting with doing things even if they aren’t perfect. The focus is on progress and effort rather than flawless outcomes. For example:
•	Set realistic standards: Decide what “good enough” looks like before starting a task.
•	Small exposures: Try doing a task without aiming for perfection and notice what actually happens — often, the worst fears don’t come true.
•	Reflect on effort: Acknowledge the effort you put in rather than only the result.
Over time, this helps the brain learn that imperfection isn’t dangerous — and that taking action, even imperfectly, is safe and rewarding.
If you like, we could pick a small task you’ve been avoiding and plan a step-by-step way to approach it without aiming for perfection. That way, you can start practicing this in a concrete, manageable way."
